"No.","Time","Source","Destination","Protocol","Length","Info"
"1","0.000000","192.168.2.22","57.144.115.32","TLSv1.2","123","Application Data"
"2","0.003914","57.144.115.32","192.168.2.22","TCP","60","443  >  2198 [ACK] Seq=1 Ack=70 Win=2507 Len=0"
"3","0.085021","57.144.115.32","192.168.2.22","TLSv1.2","125","Application Data"
"4","0.128075","192.168.2.22","57.144.115.32","TCP","1446","2198  >  443 [ACK] Seq=70 Ack=72 Win=260 Len=1392 [TCP PDU reassembled in 15]"
"5","0.128075","192.168.2.22","57.144.115.32","TCP","1446","2198  >  443 [ACK] Seq=1462 Ack=72 Win=260 Len=1392 [TCP PDU reassembled in 15]"
"6","0.128075","192.168.2.22","57.144.115.32","TCP","1446","2198  >  443 [ACK] Seq=2854 Ack=72 Win=260 Len=1392 [TCP PDU reassembled in 15]"
"7","0.128075","192.168.2.22","57.144.115.32","TCP","1446","2198  >  443 [ACK] Seq=4246 Ack=72 Win=260 Len=1392 [TCP PDU reassembled in 15]"
"8","0.128075","192.168.2.22","57.144.115.32","TCP","1446","2198  >  443 [ACK] Seq=5638 Ack=72 Win=260 Len=1392 [TCP PDU reassembled in 15]"
"9","0.128075","192.168.2.22","57.144.115.32","TCP","1446","2198  >  443 [ACK] Seq=7030 Ack=72 Win=260 Len=1392 [TCP PDU reassembled in 15]"
"10","0.128075","192.168.2.22","57.144.115.32","TCP","1446","2198  >  443 [ACK] Seq=8422 Ack=72 Win=260 Len=1392 [TCP PDU reassembled in 15]"
"11","0.128075","192.168.2.22","57.144.115.32","TCP","1446","2198  >  443 [ACK] Seq=9814 Ack=72 Win=260 Len=1392 [TCP PDU reassembled in 15]"
"12","0.128075","192.168.2.22","57.144.115.32","TCP","1446","2198  >  443 [ACK] Seq=11206 Ack=72 Win=260 Len=1392 [TCP PDU reassembled in 15]"
"13","0.128075","192.168.2.22","57.144.115.32","TCP","1446","2198  >  443 [ACK] Seq=12598 Ack=72 Win=260 Len=1392 [TCP PDU reassembled in 15]"
"14","0.128075","192.168.2.22","57.144.115.32","TCP","1446","2198  >  443 [ACK] Seq=13990 Ack=72 Win=260 Len=1392 [TCP PDU reassembled in 15]"
"15","0.128075","192.168.2.22","57.144.115.32","TLSv1.2","1148","Application Data"
"16","0.128233","192.168.2.22","57.144.115.32","TLSv1.2","454","Application Data"
"17","0.132309","57.144.115.32","192.168.2.22","TCP","60","443  >  2198 [ACK] Seq=72 Ack=1462 Win=2518 Len=0"
"18","0.133106","57.144.115.32","192.168.2.22","TCP","60","443  >  2198 [ACK] Seq=72 Ack=4246 Win=2540 Len=0"
"19","0.133106","57.144.115.32","192.168.2.22","TCP","60","443  >  2198 [ACK] Seq=72 Ack=5638 Win=2551 Len=0"
"20","0.133106","57.144.115.32","192.168.2.22","TCP","60","443  >  2198 [ACK] Seq=72 Ack=9814 Win=2583 Len=0"
"21","0.133877","57.144.115.32","192.168.2.22","TCP","60","443  >  2198 [ACK] Seq=72 Ack=11206 Win=2594 Len=0"
"22","0.133877","57.144.115.32","192.168.2.22","TCP","60","443  >  2198 [ACK] Seq=72 Ack=15382 Win=2627 Len=0"
"23","0.133877","57.144.115.32","192.168.2.22","TCP","60","443  >  2198 [ACK] Seq=72 Ack=16476 Win=2638 Len=0"
"24","0.133877","57.144.115.32","192.168.2.22","TCP","60","443  >  2198 [ACK] Seq=72 Ack=16876 Win=2638 Len=0"
"25","0.142424","192.168.2.22","57.144.115.32","TCP","1446","2198  >  443 [ACK] Seq=16876 Ack=72 Win=260 Len=1392 [TCP PDU reassembled in 36]"
"26","0.142424","192.168.2.22","57.144.115.32","TCP","1446","2198  >  443 [ACK] Seq=18268 Ack=72 Win=260 Len=1392 [TCP PDU reassembled in 36]"
"27","0.142424","192.168.2.22","57.144.115.32","TCP","1446","2198  >  443 [ACK] Seq=19660 Ack=72 Win=260 Len=1392 [TCP PDU reassembled in 36]"
"28","0.142424","192.168.2.22","57.144.115.32","TCP","1446","2198  >  443 [ACK] Seq=21052 Ack=72 Win=260 Len=1392 [TCP PDU reassembled in 36]"
"29","0.142424","192.168.2.22","57.144.115.32","TCP","1446","2198  >  443 [ACK] Seq=22444 Ack=72 Win=260 Len=1392 [TCP PDU reassembled in 36]"
"30","0.142424","192.168.2.22","57.144.115.32","TCP","1446","2198  >  443 [ACK] Seq=23836 Ack=72 Win=260 Len=1392 [TCP PDU reassembled in 36]"
"31","0.142424","192.168.2.22","57.144.115.32","TCP","1446","2198  >  443 [ACK] Seq=25228 Ack=72 Win=260 Len=1392 [TCP PDU reassembled in 36]"
"32","0.142424","192.168.2.22","57.144.115.32","TCP","1446","2198  >  443 [ACK] Seq=26620 Ack=72 Win=260 Len=1392 [TCP PDU reassembled in 36]"
"33","0.142424","192.168.2.22","57.144.115.32","TCP","1446","2198  >  443 [ACK] Seq=28012 Ack=72 Win=260 Len=1392 [TCP PDU reassembled in 36]"
"34","0.142424","192.168.2.22","57.144.115.32","TCP","1446","2198  >  443 [ACK] Seq=29404 Ack=72 Win=260 Len=1392 [TCP PDU reassembled in 36]"
"35","0.142424","192.168.2.22","57.144.115.32","TCP","1446","2198  >  443 [ACK] Seq=30796 Ack=72 Win=260 Len=1392 [TCP PDU reassembled in 36]"
"36","0.142424","192.168.2.22","57.144.115.32","TLSv1.2","1148","Application Data"
"37","0.142591","192.168.2.22","57.144.115.32","TLSv1.2","314","Application Data"
"38","0.146238","57.144.115.32","192.168.2.22","TCP","60","443  >  2198 [ACK] Seq=72 Ack=18268 Win=2648 Len=0"
"39","0.147027","57.144.115.32","192.168.2.22","TCP","60","443  >  2198 [ACK] Seq=72 Ack=19660 Win=2659 Len=0"
"40","0.147027","57.144.115.32","192.168.2.22","TCP","60","443  >  2198 [ACK] Seq=72 Ack=21052 Win=2670 Len=0"
"41","0.147027","57.144.115.32","192.168.2.22","TCP","60","443  >  2198 [ACK] Seq=72 Ack=22444 Win=2681 Len=0"
"42","0.147800","57.144.115.32","192.168.2.22","TCP","60","443  >  2198 [ACK] Seq=72 Ack=23836 Win=2692 Len=0"
"43","0.147800","57.144.115.32","192.168.2.22","TCP","60","443  >  2198 [ACK] Seq=72 Ack=25228 Win=2703 Len=0"
"44","0.147800","57.144.115.32","192.168.2.22","TCP","60","443  >  2198 [ACK] Seq=72 Ack=26620 Win=2714 Len=0"
"45","0.147800","57.144.115.32","192.168.2.22","TCP","60","443  >  2198 [ACK] Seq=72 Ack=28012 Win=2725 Len=0"
"46","0.148633","57.144.115.32","192.168.2.22","TCP","60","443  >  2198 [ACK] Seq=72 Ack=29404 Win=2735 Len=0"
"47","0.148633","57.144.115.32","192.168.2.22","TCP","60","443  >  2198 [ACK] Seq=72 Ack=30796 Win=2746 Len=0"
"48","0.148633","57.144.115.32","192.168.2.22","TCP","60","443  >  2198 [ACK] Seq=72 Ack=32188 Win=2757 Len=0"
"49","0.148633","57.144.115.32","192.168.2.22","TCP","60","443  >  2198 [ACK] Seq=72 Ack=33282 Win=2768 Len=0"
"50","0.148633","57.144.115.32","192.168.2.22","TCP","60","443  >  2198 [ACK] Seq=72 Ack=33542 Win=2768 Len=0"
"51","0.639660","57.144.115.32","192.168.2.22","TCP","1446","443  >  2198 [ACK] Seq=72 Ack=33542 Win=2768 Len=1392 [TCP PDU reassembled in 52]"
"52","0.639660","57.144.115.32","192.168.2.22","TLSv1.2","1446","Application Data"
"53","0.639660","57.144.115.32","192.168.2.22","TLSv1.2","1378","Application Data"
"54","0.639660","57.144.115.32","192.168.2.22","TCP","1446","443  >  2198 [ACK] Seq=4180 Ack=33542 Win=2768 Len=1392 [TCP PDU reassembled in 57]"
"55","0.639754","192.168.2.22","57.144.115.32","TCP","54","2198  >  443 [ACK] Seq=33542 Ack=5572 Win=261 Len=0"
"56","0.640655","57.144.115.32","192.168.2.22","TCP","1446","443  >  2198 [ACK] Seq=5572 Ack=33542 Win=2768 Len=1392 [TCP PDU reassembled in 57]"
"57","0.640655","57.144.115.32","192.168.2.22","TLSv1.2","1356","Application Data"
"58","0.640655","57.144.115.32","192.168.2.22","TCP","1446","443  >  2198 [ACK] Seq=8266 Ack=33542 Win=2768 Len=1392 [TCP PDU reassembled in 60]"
"59","0.640655","57.144.115.32","192.168.2.22","TCP","1446","443  >  2198 [ACK] Seq=9658 Ack=33542 Win=2768 Len=1392 [TCP PDU reassembled in 60]"
"60","0.640655","57.144.115.32","192.168.2.22","TLSv1.2","1356","Application Data"
"61","0.640655","57.144.115.32","192.168.2.22","TCP","1446","443  >  2198 [ACK] Seq=12352 Ack=33542 Win=2768 Len=1392 [TCP PDU reassembled in 64]"
"62","0.640655","57.144.115.32","192.168.2.22","TCP","1446","443  >  2198 [ACK] Seq=13744 Ack=33542 Win=2768 Len=1392 [TCP PDU reassembled in 64]"
"63","0.640737","192.168.2.22","57.144.115.32","TCP","54","2198  >  443 [ACK] Seq=33542 Ack=15136 Win=261 Len=0"
"64","0.641662","57.144.115.32","192.168.2.22","TLSv1.2","1446","Application Data"
"65","0.641662","57.144.115.32","192.168.2.22","TCP","1446","443  >  2198 [ACK] Seq=16528 Ack=33542 Win=2768 Len=1392 [TCP PDU reassembled in 66]"
"66","0.641662","57.144.115.32","192.168.2.22","TLSv1.2","1446","Application Data"
"67","0.641662","57.144.115.32","192.168.2.22","TLSv1.2","1288","Application Data"
"68","0.641662","57.144.115.32","192.168.2.22","TCP","1446","443  >  2198 [ACK] Seq=20546 Ack=33542 Win=2768 Len=1392 [TCP PDU reassembled in 70]"
"69","0.641662","57.144.115.32","192.168.2.22","TCP","1446","443  >  2198 [ACK] Seq=21938 Ack=33542 Win=2768 Len=1392 [TCP PDU reassembled in 70]"
"70","0.641662","57.144.115.32","192.168.2.22","TLSv1.2","1356","Application Data"
"71","0.641739","192.168.2.22","57.144.115.32","TCP","54","2198  >  443 [ACK] Seq=33542 Ack=24632 Win=261 Len=0"
"72","0.642659","57.144.115.32","192.168.2.22","TCP","1446","443  >  2198 [ACK] Seq=24632 Ack=33542 Win=2768 Len=1392 [TCP PDU reassembled in 74]"
"73","0.642659","57.144.115.32","192.168.2.22","TCP","1446","443  >  2198 [ACK] Seq=26024 Ack=33542 Win=2768 Len=1392 [TCP PDU reassembled in 74]"
"74","0.642659","57.144.115.32","192.168.2.22","TLSv1.2","1446","Application Data"
"75","0.642659","57.144.115.32","192.168.2.22","TCP","1446","443  >  2198 [ACK] Seq=28808 Ack=33542 Win=2768 Len=1392 [TCP PDU reassembled in 78]"
"76","0.642724","192.168.2.22","57.144.115.32","TCP","54","2198  >  443 [ACK] Seq=33542 Ack=30200 Win=261 Len=0"
"77","0.643681","57.144.115.32","192.168.2.22","TCP","1446","443  >  2198 [ACK] Seq=30200 Ack=33542 Win=2768 Len=1392 [TCP PDU reassembled in 78]"
"78","0.643681","57.144.115.32","192.168.2.22","TLSv1.2","1446","Application Data"
"79","0.643681","57.144.115.32","192.168.2.22","TLSv1.2","1387","Application Data"
"80","0.643681","57.144.115.32","192.168.2.22","TCP","1446","443  >  2198 [ACK] Seq=34317 Ack=33542 Win=2768 Len=1392 [TCP PDU reassembled in 81]"
"81","0.643681","57.144.115.32","192.168.2.22","TLSv1.2","1446","Application Data"
"82","0.643681","57.144.115.32","192.168.2.22","TCP","1446","443  >  2198 [ACK] Seq=37101 Ack=33542 Win=2768 Len=1392 [TCP PDU reassembled in 84]"
"83","0.643681","57.144.115.32","192.168.2.22","TCP","1446","443  >  2198 [ACK] Seq=38493 Ack=33542 Win=2768 Len=1392 [TCP PDU reassembled in 84]"
"84","0.643681","57.144.115.32","192.168.2.22","TLSv1.2","1167","Application Data"
"85","0.643790","192.168.2.22","57.144.115.32","TCP","54","2198  >  443 [ACK] Seq=33542 Ack=40998 Win=261 Len=0"
"86","0.644666","57.144.115.32","192.168.2.22","TCP","1446","443  >  2198 [ACK] Seq=40998 Ack=33542 Win=2768 Len=1392 [TCP PDU reassembled in 87]"
"87","0.644666","57.144.115.32","192.168.2.22","TLSv1.2","1133","Application Data, Application Data"
"88","0.644712","192.168.2.22","57.144.115.32","TCP","54","2198  >  443 [ACK] Seq=33542 Ack=43469 Win=261 Len=0"
"89","0.655203","57.144.115.32","192.168.2.22","TCP","1446","443  >  2198 [ACK] Seq=43469 Ack=33542 Win=2768 Len=1392 [TCP PDU reassembled in 90]"
"90","0.655203","57.144.115.32","192.168.2.22","TLSv1.2","1446","Application Data"
"91","0.655291","192.168.2.22","57.144.115.32","TCP","54","2198  >  443 [ACK] Seq=33542 Ack=46253 Win=261 Len=0"
"92","0.656211","57.144.115.32","192.168.2.22","TLSv1.2","1378","Application Data"
"93","0.656211","57.144.115.32","192.168.2.22","TCP","1446","443  >  2198 [ACK] Seq=47577 Ack=33542 Win=2768 Len=1392 [TCP PDU reassembled in 95]"
"94","0.656211","57.144.115.32","192.168.2.22","TCP","1446","443  >  2198 [ACK] Seq=48969 Ack=33542 Win=2768 Len=1392 [TCP PDU reassembled in 95]"
"95","0.656211","57.144.115.32","192.168.2.22","TLSv1.2","1446","Application Data"
"96","0.656211","57.144.115.32","192.168.2.22","TCP","1446","443  >  2198 [ACK] Seq=51753 Ack=33542 Win=2768 Len=1392 [TCP PDU reassembled in 98]"
"97","0.656211","57.144.115.32","192.168.2.22","TCP","1446","443  >  2198 [ACK] Seq=53145 Ack=33542 Win=2768 Len=1392 [TCP PDU reassembled in 98]"
"98","0.656211","57.144.115.32","192.168.2.22","TLSv1.2","1266","Application Data"
"99","0.656320","192.168.2.22","57.144.115.32","TCP","54","2198  >  443 [ACK] Seq=33542 Ack=55749 Win=261 Len=0"
"100","0.657198","57.144.115.32","192.168.2.22","TCP","1446","443  >  2198 [ACK] Seq=55749 Ack=33542 Win=2768 Len=1392 [TCP PDU reassembled in 102]"
"101","0.657198","57.144.115.32","192.168.2.22","TCP","1446","443  >  2198 [ACK] Seq=57141 Ack=33542 Win=2768 Len=1392 [TCP PDU reassembled in 102]"
"102","0.657198","57.144.115.32","192.168.2.22","TLSv1.2","1446","Application Data"
"103","0.657198","57.144.115.32","192.168.2.22","TCP","1446","443  >  2198 [ACK] Seq=59925 Ack=33542 Win=2768 Len=1392 [TCP PDU reassembled in 104]"
"104","0.657198","57.144.115.32","192.168.2.22","TLSv1.2","1446","Application Data"
"105","0.657198","57.144.115.32","192.168.2.22","TLSv1.2","1288","Application Data"
"106","0.657198","57.144.115.32","192.168.2.22","TCP","1446","443  >  2198 [ACK] Seq=63943 Ack=33542 Win=2768 Len=1392 [TCP PDU reassembled in 109]"
"107","0.657283","192.168.2.22","57.144.115.32","TCP","54","2198  >  443 [ACK] Seq=33542 Ack=65335 Win=261 Len=0"
"108","0.658712","57.144.115.32","192.168.2.22","TCP","1446","443  >  2198 [ACK] Seq=65335 Ack=33542 Win=2768 Len=1392 [TCP PDU reassembled in 109]"
"109","0.658712","57.144.115.32","192.168.2.22","TLSv1.2","1356","Application Data"
"110","0.658712","57.144.115.32","192.168.2.22","TCP","1446","443  >  2198 [ACK] Seq=68029 Ack=33542 Win=2768 Len=1392 [TCP PDU reassembled in 112]"
"111","0.658712","57.144.115.32","192.168.2.22","TCP","1446","443  >  2198 [ACK] Seq=69421 Ack=33542 Win=2768 Len=1392 [TCP PDU reassembled in 112]"
"112","0.658712","57.144.115.32","192.168.2.22","TLSv1.2","1446","Application Data"
"113","0.658712","57.144.115.32","192.168.2.22","TCP","1446","443  >  2198 [ACK] Seq=72205 Ack=33542 Win=2768 Len=1392 [TCP PDU reassembled in 115]"
"114","0.658712","57.144.115.32","192.168.2.22","TCP","1446","443  >  2198 [ACK] Seq=73597 Ack=33542 Win=2768 Len=1392 [TCP PDU reassembled in 115]"
"115","0.658712","57.144.115.32","192.168.2.22","TLSv1.2","1446","Application Data"
"116","0.658828","192.168.2.22","57.144.115.32","TCP","54","2198  >  443 [ACK] Seq=33542 Ack=76381 Win=261 Len=0"
"117","0.659707","57.144.115.32","192.168.2.22","TLSv1.2","1387","Application Data"
"118","0.659707","57.144.115.32","192.168.2.22","TCP","1446","443  >  2198 [ACK] Seq=77714 Ack=33542 Win=2768 Len=1392 [TCP PDU reassembled in 119]"
"119","0.659707","57.144.115.32","192.168.2.22","TLSv1.2","1446","Application Data"
"120","0.659707","57.144.115.32","192.168.2.22","TCP","1446","443  >  2198 [ACK] Seq=80498 Ack=33542 Win=2768 Len=1392 [TCP PDU reassembled in 122]"
"121","0.659707","57.144.115.32","192.168.2.22","TCP","1446","443  >  2198 [ACK] Seq=81890 Ack=33542 Win=2768 Len=1392 [TCP PDU reassembled in 122]"
"122","0.659707","57.144.115.32","192.168.2.22","TLSv1.2","1167","Application Data"
"123","0.659793","192.168.2.22","57.144.115.32","TCP","54","2198  >  443 [ACK] Seq=33542 Ack=84395 Win=261 Len=0"
"124","0.660704","57.144.115.32","192.168.2.22","TCP","1446","443  >  2198 [ACK] Seq=84395 Ack=33542 Win=2768 Len=1392 [TCP PDU reassembled in 125]"
"125","0.660704","57.144.115.32","192.168.2.22","TLSv1.2","888","Application Data, Application Data"
"126","0.660737","192.168.2.22","57.144.115.32","TCP","54","2198  >  443 [ACK] Seq=33542 Ack=86621 Win=261 Len=0"
"127","0.838053","192.168.2.1","239.255.255.250","IGMPv2","60","Membership Report group 239.255.255.250"
"128","0.847634","00:ff:ff:cc:11:10","Broadcast","0xfffa","95","Ethernet II"
"129","1.223907","52.1.111.67","192.168.2.22","TLSv1.2","100","Application Data"
"130","1.224213","192.168.2.22","52.1.111.67","TCP","54","2168  >  443 [FIN, ACK] Seq=1 Ack=47 Win=256 Len=0"
"131","1.224797","52.1.111.67","192.168.2.22","TLSv1.2","85","Encrypted Alert"
"132","1.224797","52.1.111.67","192.168.2.22","TCP","60","443  >  2168 [FIN, ACK] Seq=78 Ack=1 Win=336 Len=0"
"133","1.224869","192.168.2.22","52.1.111.67","TCP","54","2168  >  443 [RST, ACK] Seq=2 Ack=78 Win=0 Len=0"
"134","1.314209","52.1.111.67","192.168.2.22","TCP","60","443  >  2168 [ACK] Seq=79 Ack=2 Win=336 Len=0"
"135","1.619554","192.168.2.22","104.18.32.47","TCP","55","2164  >  443 [ACK] Seq=1 Ack=1 Win=257 Len=1 [TCP PDU reassembled in 420]"
"136","1.709181","104.18.32.47","192.168.2.22","TCP","66","443  >  2164 [ACK] Seq=1 Ack=2 Win=59 Len=0 SLE=1 SRE=2"
"137","1.958355","192.168.2.22","186.233.185.147","TCP","55","1726  >  443 [ACK] Seq=1 Ack=1 Win=260 Len=1"
"138","2.024458","186.233.185.147","192.168.2.22","TCP","66","443  >  1726 [ACK] Seq=1 Ack=2 Win=501 Len=0 SLE=1 SRE=2"
"139","2.201194","192.168.2.22","57.144.115.32","TLSv1.2","272","Application Data"
"140","2.205030","57.144.115.32","192.168.2.22","TCP","60","443  >  2198 [ACK] Seq=86621 Ack=33760 Win=2768 Len=0"
"141","2.295446","192.168.2.22","57.144.115.32","TLSv1.2","303","Application Data"
"142","2.299288","57.144.115.32","192.168.2.22","TCP","60","443  >  2198 [ACK] Seq=86621 Ack=34009 Win=2768 Len=0"
"143","2.302585","192.168.2.22","52.112.84.161","TLSv1.2","111","Application Data"
"144","2.332541","57.144.115.32","192.168.2.22","TLSv1.2","667","Application Data"
"145","2.378284","52.112.84.161","192.168.2.22","TLSv1.2","100","Application Data"
"146","2.386063","192.168.2.22","57.144.115.32","TCP","54","2198  >  443 [ACK] Seq=34009 Ack=87234 Win=258 Len=0"
"147","2.416547","192.168.2.22","52.112.84.161","TCP","54","1791  >  443 [ACK] Seq=58 Ack=47 Win=260 Len=0"
"148","2.423361","192.168.2.22","172.64.155.209","TCP","55","2148  >  443 [ACK] Seq=1 Ack=1 Win=251 Len=1 [TCP PDU reassembled in 212]"
"149","2.428092","57.144.115.32","192.168.2.22","TLSv1.2","787","Application Data"
"150","2.478227","192.168.2.22","57.144.115.32","TCP","54","2198  >  443 [ACK] Seq=34009 Ack=87967 Win=255 Len=0"
"151","2.489580","192.168.2.22","10.3.0.20","TCP","66","2228  >  1688 [SYN] Seq=0 Win=8192 Len=0 MSS=1460 WS=256 SACK_PERM"
"152","2.490486","172.64.155.209","192.168.2.22","TCP","66","443  >  2148 [ACK] Seq=1 Ack=2 Win=8 Len=0 SLE=1 SRE=2"
"153","2.650363","192.168.2.22","192.168.2.1","DNS","78","Standard query 0xfc66 A graph.whatsapp.net"
"154","2.650797","192.168.2.22","192.168.2.1","DNS","78","Standard query 0x194d HTTPS graph.whatsapp.net"
"155","2.654604","192.168.2.1","192.168.2.22","DNS","140","Standard query response 0xfc66 A graph.whatsapp.net CNAME static.whatsapp.net CNAME mmx-ds.cdn.whatsapp.net A 57.144.115.32"
"156","2.654604","192.168.2.1","192.168.2.22","DNS","169","Standard query response 0x194d HTTPS graph.whatsapp.net CNAME static.whatsapp.net CNAME mmx-ds.cdn.whatsapp.net SOA a.ns.whatsapp.net"
"157","2.655920","192.168.2.22","57.144.115.32","TCP","66","2229  >  443 [SYN] Seq=0 Win=8192 Len=0 MSS=1460 WS=256 SACK_PERM"
"158","2.660108","57.144.115.32","192.168.2.22","TCP","66","443  >  2229 [SYN, ACK] Seq=0 Ack=1 Win=65535 Len=0 MSS=1392 SACK_PERM WS=256"
"159","2.660246","192.168.2.22","57.144.115.32","TCP","54","2229  >  443 [ACK] Seq=1 Ack=1 Win=66816 Len=0"
"160","2.661055","192.168.2.22","57.144.115.32","TCP","1446","2229  >  443 [ACK] Seq=1 Ack=1 Win=66816 Len=1392 [TCP PDU reassembled in 161]"
"161","2.661055","192.168.2.22","57.144.115.32","TLSv1.3","390","Client Hello (SNI=graph.whatsapp.net)"
"162","2.665121","57.144.115.32","192.168.2.22","TCP","60","443  >  2229 [ACK] Seq=1 Ack=1393 Win=68352 Len=0"
"163","2.665121","57.144.115.32","192.168.2.22","TCP","60","443  >  2229 [ACK] Seq=1 Ack=1729 Win=71168 Len=0"
"164","2.667132","57.144.115.32","192.168.2.22","TLSv1.3","1446","Server Hello, Change Cipher Spec, Application Data"
"165","2.667132","57.144.115.32","192.168.2.22","TLSv1.3","1446","Application Data"
"166","2.667132","57.144.115.32","192.168.2.22","TLSv1.3","209","Application Data"
"167","2.667220","192.168.2.22","57.144.115.32","TCP","54","2229  >  443 [ACK] Seq=1729 Ack=2940 Win=66816 Len=0"
"168","2.671550","192.168.2.22","57.144.115.32","TLSv1.3","118","Change Cipher Spec, Application Data"
"169","2.671875","192.168.2.22","57.144.115.32","TLSv1.3","146","Application Data"
"170","2.672662","192.168.2.22","57.144.115.32","TLSv1.3","526","Application Data"
"171","2.672810","192.168.2.22","57.144.115.32","TCP","1446","2229  >  443 [ACK] Seq=2357 Ack=2940 Win=66816 Len=1392 [TCP PDU reassembled in 173]"
"172","2.672810","192.168.2.22","57.144.115.32","TCP","1446","2229  >  443 [ACK] Seq=3749 Ack=2940 Win=66816 Len=1392 [TCP PDU reassembled in 173]"
"173","2.672810","192.168.2.22","57.144.115.32","TLSv1.3","904","Application Data"
"174","2.676167","57.144.115.32","192.168.2.22","TCP","60","443  >  2229 [ACK] Seq=2940 Ack=1885 Win=71168 Len=0"
"175","2.676167","57.144.115.32","192.168.2.22","TLSv1.3","225","Application Data"
"176","2.676167","57.144.115.32","192.168.2.22","TLSv1.3","128","Application Data"
"177","2.676167","57.144.115.32","192.168.2.22","TLSv1.3","85","Application Data"
"178","2.676268","192.168.2.22","57.144.115.32","TCP","54","2229  >  443 [ACK] Seq=5991 Ack=3216 Win=66304 Len=0"
"179","2.676694","192.168.2.22","57.144.115.32","TLSv1.3","85","Application Data"
"180","2.677666","57.144.115.32","192.168.2.22","TLSv1.3","89","Application Data"
"181","2.677666","57.144.115.32","192.168.2.22","TCP","60","443  >  2229 [ACK] Seq=3251 Ack=5991 Win=81408 Len=0"
"182","2.720307","57.144.115.32","192.168.2.22","TCP","60","443  >  2229 [ACK] Seq=3251 Ack=6022 Win=81408 Len=0"
"183","2.729830","192.168.2.22","57.144.115.32","TCP","54","2229  >  443 [ACK] Seq=6022 Ack=3251 Win=66304 Len=0"
"184","2.821681","57.144.115.32","192.168.2.22","TLSv1.3","451","Application Data"
"185","2.876266","192.168.2.22","57.144.115.32","TCP","54","2229  >  443 [ACK] Seq=6022 Ack=3648 Win=66048 Len=0"
"186","5.489337","192.168.2.22","10.3.0.20","TCP","66","[TCP Retransmission] 2228  >  1688 [SYN] Seq=0 Win=8192 Len=0 MSS=1460 WS=256 SACK_PERM"
"187","5.857563","00:ff:ff:cc:11:10","Broadcast","0xfffa","95","Ethernet II"
"188","5.898979","57.144.115.32","192.168.2.22","TLSv1.2","332","Application Data"
"189","5.949333","192.168.2.22","57.144.115.32","TCP","54","2198  >  443 [ACK] Seq=34009 Ack=88245 Win=261 Len=0"
"190","7.487909","192.168.2.1","239.255.255.250","IGMPv2","60","Membership Report group 239.255.255.250"
"191","7.553805","172.64.150.28","192.168.2.22","TLSv1.2","93","Application Data"
"192","7.554181","192.168.2.22","172.64.150.28","TCP","54","2156  >  443 [FIN, ACK] Seq=1 Ack=40 Win=254 Len=0"
"193","7.554628","172.64.150.28","192.168.2.22","TCP","60","443  >  2156 [FIN, ACK] Seq=40 Ack=1 Win=10 Len=0"
"194","7.554679","192.168.2.22","172.64.150.28","TCP","54","2156  >  443 [ACK] Seq=2 Ack=41 Win=254 Len=0"
"195","7.559642","172.64.150.28","192.168.2.22","TCP","60","443  >  2156 [ACK] Seq=41 Ack=2 Win=10 Len=0"
"196","7.748618","TpLinkPte_5d:b9:28","Broadcast","ARP","60","Who has 192.168.2.22? Tell 192.168.2.1"
"197","7.748649","HewlettPacka_22:6f:da","TpLinkPte_5d:b9:28","ARP","42","192.168.2.22 is at 70:5a:0f:22:6f:da"
"198","7.954303","192.168.2.10","224.0.0.251","MDNS","119","Standard query 0x000f PTR _674A0243._sub._googlecast._tcp.local, ""QM"" question PTR _8E6C866D._sub._googlecast._tcp.local, ""QM"" question PTR _googlecast._tcp.local, ""QM"" question"
"199","8.988571","192.168.2.22","57.144.115.32","TLSv1.2","126","Application Data"
"200","9.034067","57.144.115.32","192.168.2.22","TCP","60","443  >  2198 [ACK] Seq=88245 Ack=34081 Win=2768 Len=0"
"201","10.867486","00:ff:ff:cc:11:10","Broadcast","0xfffa","95","Ethernet II"
"202","11.489152","192.168.2.22","10.3.0.20","TCP","62","[TCP Retransmission] 2228  >  1688 [SYN] Seq=0 Win=8192 Len=0 MSS=1460 SACK_PERM"
"203","12.026159","192.168.2.22","186.233.185.147","TCP","55","[TCP Keep-Alive] 1726  >  443 [ACK] Seq=1 Ack=1 Win=260 Len=1"
"204","12.092331","186.233.185.147","192.168.2.22","TCP","66","[TCP Keep-Alive ACK] 443  >  1726 [ACK] Seq=1 Ack=2 Win=501 Len=0 SLE=1 SRE=2"
"205","13.544735","192.168.2.22","92.122.157.123","TCP","55","2212  >  443 [ACK] Seq=1 Ack=1 Win=255 Len=1"
"206","13.548584","92.122.157.123","192.168.2.22","TCP","66","443  >  2212 [ACK] Seq=1 Ack=2 Win=501 Len=0 SLE=1 SRE=2"
"207","14.446846","192.168.2.22","104.17.142.115","TLSv1.2","151","Application Data"
"208","14.446925","192.168.2.22","104.17.142.115","TLSv1.2","93","Application Data"
"209","14.596399","104.17.142.115","192.168.2.22","TCP","60","443  >  2165 [ACK] Seq=1 Ack=98 Win=10 Len=0"
"210","14.596399","104.17.142.115","192.168.2.22","TCP","60","443  >  2165 [ACK] Seq=1 Ack=137 Win=10 Len=0"
"211","14.596399","104.17.142.115","192.168.2.22","TLSv1.2","93","Application Data"
"212","14.597729","192.168.2.22","172.64.155.209","TLSv1.2","116","Ignored Unknown Record"
"213","14.597787","192.168.2.22","172.64.155.209","TLSv1.2","93","Application Data"
"214","14.608756","192.168.2.22","192.168.2.1","DNS","85","Standard query 0xd04f A webapp.chatgpt4google.com"
"215","14.609044","192.168.2.22","192.168.2.1","DNS","85","Standard query 0xc6d7 HTTPS webapp.chatgpt4google.com"
"216","14.612514","192.168.2.1","192.168.2.22","DNS","117","Standard query response 0xd04f A webapp.chatgpt4google.com A 13.248.221.112 A 76.223.90.71"
"217","14.613381","192.168.2.1","192.168.2.22","DNS","167","Standard query response 0xc6d7 HTTPS webapp.chatgpt4google.com SOA ns-1009.awsdns-62.net"
"218","14.613955","192.168.2.22","13.248.221.112","TCP","66","2230  >  443 [SYN] Seq=0 Win=8192 Len=0 MSS=1460 WS=256 SACK_PERM"
"219","14.617516","13.248.221.112","192.168.2.22","TCP","66","443  >  2230 [SYN, ACK] Seq=0 Ack=1 Win=65535 Len=0 MSS=1452 SACK_PERM WS=256"
"220","14.617647","192.168.2.22","13.248.221.112","TCP","54","2230  >  443 [ACK] Seq=1 Ack=1 Win=66560 Len=0"
"221","14.618583","192.168.2.22","13.248.221.112","TCP","1506","2230  >  443 [ACK] Seq=1 Ack=1 Win=66560 Len=1452 [TCP PDU reassembled in 222]"
"222","14.618583","192.168.2.22","13.248.221.112","TLSv1.3","522","Client Hello (SNI=webapp.chatgpt4google.com)"
"223","14.622450","13.248.221.112","192.168.2.22","TCP","60","443  >  2230 [ACK] Seq=1 Ack=1453 Win=82432 Len=0"
"224","14.622450","13.248.221.112","192.168.2.22","TCP","60","443  >  2230 [ACK] Seq=1 Ack=1921 Win=85248 Len=0"
"225","14.646592","192.168.2.22","104.17.142.115","TCP","54","2165  >  443 [ACK] Seq=137 Ack=40 Win=254 Len=0"
"226","14.665083","172.64.155.209","192.168.2.22","TCP","60","443  >  2148 [ACK] Seq=1 Ack=64 Win=8 Len=0"
"227","14.665083","172.64.155.209","192.168.2.22","TCP","60","443  >  2148 [ACK] Seq=1 Ack=103 Win=8 Len=0"
"228","14.665979","172.64.155.209","192.168.2.22","TLSv1.2","93","Application Data"
"229","14.703044","192.168.2.22","172.64.155.209","TCP","54","2148  >  443 [ACK] Seq=103 Ack=40 Win=251 Len=0"
"230","14.750543","13.248.221.112","192.168.2.22","TLSv1.3","288","Server Hello, Change Cipher Spec, Application Data, Application Data"
"231","14.751628","192.168.2.22","13.248.221.112","TLSv1.3","118","Change Cipher Spec, Application Data"
"232","14.752036","192.168.2.22","13.248.221.112","TLSv1.3","146","Application Data"
"233","14.752675","192.168.2.22","13.248.221.112","TLSv1.3","510","Application Data"
"234","14.755897","13.248.221.112","192.168.2.22","TCP","60","443  >  2230 [ACK] Seq=235 Ack=1985 Win=85248 Len=0"
"235","14.755897","13.248.221.112","192.168.2.22","TCP","60","443  >  2230 [ACK] Seq=235 Ack=2077 Win=85248 Len=0"
"236","14.756834","13.248.221.112","192.168.2.22","TCP","60","443  >  2230 [ACK] Seq=235 Ack=2533 Win=88064 Len=0"
"237","14.821739","13.248.221.112","192.168.2.22","TLSv1.3","233","Application Data"
"238","14.821739","13.248.221.112","192.168.2.22","TLSv1.3","125","Application Data"
"239","14.821853","192.168.2.22","13.248.221.112","TCP","54","2230  >  443 [ACK] Seq=2533 Ack=485 Win=66304 Len=0"
"240","14.822270","192.168.2.22","13.248.221.112","TLSv1.3","85","Application Data"
"241","14.822701","13.248.221.112","192.168.2.22","TLSv1.3","239","Application Data"
"242","14.825519","13.248.221.112","192.168.2.22","TCP","60","443  >  2230 [ACK] Seq=670 Ack=2564 Win=88064 Len=0"
"243","14.850573","172.64.155.209","192.168.2.22","TLSv1.2","923","Application Data"
"244","14.851915","172.64.155.209","192.168.2.22","TLSv1.2","87","Application Data"
"245","14.851915","172.64.155.209","192.168.2.22","TLSv1.2","85","Application Data"
"246","14.852015","192.168.2.22","172.64.155.209","TCP","54","2148  >  443 [ACK] Seq=103 Ack=973 Win=257 Len=0"
"247","14.854009","192.168.2.22","172.64.155.209","TLSv1.2","89","Application Data"
"248","14.872716","192.168.2.22","13.248.221.112","TCP","54","2230  >  443 [ACK] Seq=2564 Ack=670 Win=66048 Len=0"
"249","14.882253","104.17.142.115","192.168.2.22","TLSv1.2","285","Application Data"
"250","14.883351","104.17.142.115","192.168.2.22","TLSv1.2","293","Application Data"
"251","14.883351","104.17.142.115","192.168.2.22","TLSv1.2","85","Application Data"
"252","14.883421","192.168.2.22","104.17.142.115","TCP","54","2165  >  443 [ACK] Seq=137 Ack=541 Win=252 Len=0"
"253","14.885716","192.168.2.22","104.17.142.115","TLSv1.2","89","Application Data"
"254","14.961936","172.64.155.209","192.168.2.22","TCP","60","443  >  2148 [ACK] Seq=973 Ack=138 Win=8 Len=0"
"255","15.074378","104.17.142.115","192.168.2.22","TCP","60","443  >  2165 [ACK] Seq=541 Ack=172 Win=10 Len=0"
"256","15.439103","192.168.2.22","143.204.23.44","TLSv1.2","125","Application Data"
"257","15.439172","192.168.2.22","143.204.23.44","TLSv1.2","93","Application Data"
"258","15.439209","192.168.2.22","143.204.23.44","TLSv1.2","1260","Application Data"
"259","15.443010","143.204.23.44","192.168.2.22","TCP","60","443  >  2166 [ACK] Seq=1 Ack=72 Win=164 Len=0"
"260","15.443884","143.204.23.44","192.168.2.22","TCP","60","443  >  2166 [ACK] Seq=1 Ack=111 Win=164 Len=0"
"261","15.443884","143.204.23.44","192.168.2.22","TCP","60","443  >  2166 [ACK] Seq=1 Ack=1317 Win=169 Len=0"
"262","15.443884","143.204.23.44","192.168.2.22","TLSv1.2","93","Application Data"
"263","15.494098","192.168.2.22","143.204.23.44","TCP","54","2166  >  443 [ACK] Seq=1317 Ack=40 Win=258 Len=0"
"264","15.764211","143.204.23.44","192.168.2.22","TLSv1.2","607","Application Data"
"265","15.764211","143.204.23.44","192.168.2.22","TLSv1.2","85","Application Data"
"266","15.764318","192.168.2.22","143.204.23.44","TCP","54","2166  >  443 [ACK] Seq=1317 Ack=624 Win=256 Len=0"
"267","15.766840","192.168.2.22","143.204.23.44","TLSv1.2","89","Application Data"
"268","15.825006","143.204.23.44","192.168.2.22","TCP","60","443  >  2166 [ACK] Seq=624 Ack=1352 Win=169 Len=0"
"269","15.877540","00:ff:ff:cc:11:10","Broadcast","0xfffa","95","Ethernet II"
"270","16.188735","192.168.2.22","104.18.32.47","TCP","1454","2160  >  443 [ACK] Seq=1 Ack=1 Win=1330 Len=1400 [TCP PDU reassembled in 275]"
"271","16.188735","192.168.2.22","104.18.32.47","TCP","1454","2160  >  443 [ACK] Seq=1401 Ack=1 Win=1330 Len=1400 [TCP PDU reassembled in 275]"
"272","16.188735","192.168.2.22","104.18.32.47","TCP","1454","2160  >  443 [ACK] Seq=2801 Ack=1 Win=1330 Len=1400 [TCP PDU reassembled in 275]"
"273","16.188735","192.168.2.22","104.18.32.47","TCP","1454","2160  >  443 [ACK] Seq=4201 Ack=1 Win=1330 Len=1400 [TCP PDU reassembled in 275]"
"274","16.188735","192.168.2.22","104.18.32.47","TCP","1454","2160  >  443 [ACK] Seq=5601 Ack=1 Win=1330 Len=1400 [TCP PDU reassembled in 275]"
"275","16.188735","192.168.2.22","104.18.32.47","TLSv1.2","210","Application Data"
"276","16.188826","192.168.2.22","104.18.32.47","TLSv1.2","93","Application Data"
"277","16.188857","192.168.2.22","104.18.32.47","TLSv1.2","688","Application Data"
"278","16.279128","104.18.32.47","192.168.2.22","TCP","60","443  >  2160 [ACK] Seq=1 Ack=2801 Win=62 Len=0"
"279","16.279128","104.18.32.47","192.168.2.22","TCP","60","443  >  2160 [ACK] Seq=1 Ack=4201 Win=62 Len=0"
"280","16.279128","104.18.32.47","192.168.2.22","TCP","66","[TCP Dup ACK 279#1] 443  >  2160 [ACK] Seq=1 Ack=4201 Win=62 Len=0 SLE=7157 SRE=7196"
"281","16.280002","104.18.32.47","192.168.2.22","TCP","60","443  >  2160 [ACK] Seq=1 Ack=7196 Win=63 Len=0"
"282","16.280002","104.18.32.47","192.168.2.22","TCP","60","443  >  2160 [ACK] Seq=1 Ack=7830 Win=63 Len=0"
"283","16.280002","104.18.32.47","192.168.2.22","TLSv1.2","93","Application Data"
"284","16.320862","192.168.2.22","52.123.190.173","TLSv1.2","104","Application Data"
"285","16.327070","192.168.2.22","104.18.32.47","TCP","54","2160  >  443 [ACK] Seq=7830 Ack=40 Win=1330 Len=0"
"286","16.399500","52.123.190.173","192.168.2.22","TLSv1.2","93","Application Data"
"287","16.437671","192.168.2.22","52.123.190.173","TCP","54","1778  >  443 [ACK] Seq=51 Ack=40 Win=260 Len=0"
"288","16.580175","104.18.32.47","192.168.2.22","TLSv1.2","614","Application Data"
"289","16.581046","104.18.32.47","192.168.2.22","TCP","1506","443  >  2160 [ACK] Seq=600 Ack=7830 Win=63 Len=1452 [TCP PDU reassembled in 295]"
"290","16.581046","104.18.32.47","192.168.2.22","TCP","1506","443  >  2160 [ACK] Seq=2052 Ack=7830 Win=63 Len=1452 [TCP PDU reassembled in 295]"
"291","16.581046","104.18.32.47","192.168.2.22","TCP","1506","443  >  2160 [ACK] Seq=3504 Ack=7830 Win=63 Len=1452 [TCP PDU reassembled in 295]"
"292","16.581046","104.18.32.47","192.168.2.22","TCP","1506","443  >  2160 [PSH, ACK] Seq=4956 Ack=7830 Win=63 Len=1452 [TCP PDU reassembled in 295]"
"293","16.581046","104.18.32.47","192.168.2.22","TCP","1506","443  >  2160 [ACK] Seq=6408 Ack=7830 Win=63 Len=1452 [TCP PDU reassembled in 295]"
"294","16.581046","104.18.32.47","192.168.2.22","TCP","1506","443  >  2160 [ACK] Seq=7860 Ack=7830 Win=63 Len=1452 [TCP PDU reassembled in 295]"
"295","16.581046","104.18.32.47","192.168.2.22","TLSv1.2","1067","Application Data"
"296","16.581215","192.168.2.22","104.18.32.47","TCP","54","2160  >  443 [ACK] Seq=7830 Ack=10325 Win=1290 Len=0"
"297","16.582071","104.18.32.47","192.168.2.22","TLSv1.2","85","Application Data"
"298","16.583694","192.168.2.22","104.18.32.47","TLSv1.2","89","Application Data"
"299","16.712136","104.18.32.47","192.168.2.22","TCP","60","443  >  2160 [ACK] Seq=10356 Ack=7865 Win=63 Len=0"
"300","16.733546","192.168.2.6","224.0.0.251","MDNS","103","Standard query 0x0005 PTR _googlecast._tcp.local, ""QM"" question PTR _233637DE._sub._googlecast._tcp.local, ""QM"" question"
"301","17.174441","192.168.2.6","239.255.255.250","SSDP","167","M-SEARCH * HTTP/1.1 "
"302","18.904453","192.168.2.22","57.144.115.32","TLSv1.2","1212","Application Data"
"303","18.908173","57.144.115.32","192.168.2.22","TCP","60","443  >  2198 [ACK] Seq=88245 Ack=35239 Win=2779 Len=0"
"304","18.929955","192.168.2.22","57.144.115.32","TLSv1.2","172","Application Data"
"305","18.933602","57.144.115.32","192.168.2.22","TCP","60","443  >  2198 [ACK] Seq=88245 Ack=35357 Win=2779 Len=0"
"306","18.989660","57.144.115.32","192.168.2.22","TLSv1.2","117","Application Data"
"307","19.032738","57.144.115.32","192.168.2.22","TLSv1.2","293","Application Data"
"308","19.032842","192.168.2.22","57.144.115.32","TCP","54","2198  >  443 [ACK] Seq=35357 Ack=88547 Win=259 Len=0"
"309","19.074566","192.168.2.22","192.168.2.1","DNS","76","Standard query 0x09ed A dit.whatsapp.net"
"310","19.075329","192.168.2.22","192.168.2.1","DNS","76","Standard query 0x3f39 HTTPS dit.whatsapp.net"
"311","19.078427","192.168.2.1","192.168.2.22","DNS","140","Standard query response 0x09ed A dit.whatsapp.net CNAME scontent.whatsapp.net CNAME mmx-ds.cdn.whatsapp.net A 57.144.115.32"
"312","19.079364","192.168.2.1","192.168.2.22","DNS","169","Standard query response 0x3f39 HTTPS dit.whatsapp.net CNAME scontent.whatsapp.net CNAME mmx-ds.cdn.whatsapp.net SOA a.ns.whatsapp.net"
"313","19.081192","192.168.2.22","57.144.115.32","TLSv1.3","196","Application Data"
"314","19.081324","192.168.2.22","57.144.115.32","TLSv1.3","93","Application Data"
"315","19.081479","192.168.2.22","57.144.115.32","TLSv1.3","857","Application Data"
"316","19.083962","192.168.2.22","57.144.115.32","TLSv1.3","181","Application Data"
"317","19.084232","192.168.2.22","57.144.115.32","TLSv1.3","885","Application Data"
"318","19.084890","57.144.115.32","192.168.2.22","TCP","60","443  >  2229 [ACK] Seq=3648 Ack=6164 Win=83968 Len=0"
"319","19.085866","57.144.115.32","192.168.2.22","TCP","60","443  >  2229 [ACK] Seq=3648 Ack=6203 Win=83968 Len=0"
"320","19.085866","57.144.115.32","192.168.2.22","TLSv1.3","106","Application Data"
"321","19.087808","57.144.115.32","192.168.2.22","TCP","60","443  >  2229 [ACK] Seq=3700 Ack=7964 Win=89600 Len=0"
"322","19.088733","57.144.115.32","192.168.2.22","TLSv1.3","89","Application Data"
"323","19.088851","192.168.2.22","57.144.115.32","TCP","54","2229  >  443 [ACK] Seq=7964 Ack=3735 Win=65792 Len=0"
"324","19.090486","192.168.2.22","57.144.115.32","TLSv1.3","178","Application Data"
"325","19.090726","192.168.2.22","57.144.115.32","TLSv1.3","885","Application Data"
"326","19.095545","57.144.115.32","192.168.2.22","TCP","60","443  >  2229 [ACK] Seq=3735 Ack=8919 Win=92416 Len=0"
"327","19.095545","57.144.115.32","192.168.2.22","TLSv1.3","89","Application Data"
"328","19.098787","192.168.2.22","57.144.115.32","TLSv1.3","177","Application Data"
"329","19.098986","192.168.2.22","57.144.115.32","TLSv1.3","885","Application Data"
"330","19.102996","57.144.115.32","192.168.2.22","TCP","60","443  >  2229 [ACK] Seq=3770 Ack=9873 Win=95232 Len=0"
"331","19.102996","57.144.115.32","192.168.2.22","TLSv1.3","89","Application Data"
"332","19.152759","192.168.2.22","57.144.115.32","TCP","54","2229  >  443 [ACK] Seq=9873 Ack=3805 Win=65792 Len=0"
"333","19.157122","192.168.2.22","104.18.32.47","TCP","1454","2160  >  443 [ACK] Seq=7865 Ack=10356 Win=1290 Len=1400 [TCP PDU reassembled in 340]"
"334","19.157122","192.168.2.22","104.18.32.47","TCP","1454","2160  >  443 [ACK] Seq=9265 Ack=10356 Win=1290 Len=1400 [TCP PDU reassembled in 340]"
"335","19.157122","192.168.2.22","104.18.32.47","TCP","1454","2160  >  443 [ACK] Seq=10665 Ack=10356 Win=1290 Len=1400 [TCP PDU reassembled in 340]"
"336","19.157122","192.168.2.22","104.18.32.47","TCP","1454","2160  >  443 [ACK] Seq=12065 Ack=10356 Win=1290 Len=1400 [TCP PDU reassembled in 340]"
"337","19.157122","192.168.2.22","104.18.32.47","TCP","1454","2160  >  443 [ACK] Seq=13465 Ack=10356 Win=1290 Len=1400 [TCP PDU reassembled in 340]"
"338","19.157122","192.168.2.22","104.18.32.47","TCP","1454","2160  >  443 [ACK] Seq=14865 Ack=10356 Win=1290 Len=1400 [TCP PDU reassembled in 340]"
"339","19.157122","192.168.2.22","104.18.32.47","TCP","1454","2160  >  443 [ACK] Seq=16265 Ack=10356 Win=1290 Len=1400 [TCP PDU reassembled in 340]"
"340","19.157122","192.168.2.22","104.18.32.47","TLSv1.2","1422","Application Data"
"341","19.157287","192.168.2.22","104.18.32.47","TLSv1.2","922","Application Data"
"342","19.181052","57.144.115.32","192.168.2.22","TLSv1.3","362","Application Data"
"343","19.182841","192.168.2.22","57.144.115.32","TLSv1.3","89","Application Data"
"344","19.184359","57.144.115.32","192.168.2.22","TLSv1.3","256","Application Data"
"345","19.191665","57.144.115.32","192.168.2.22","TLSv1.3","258","Application Data"
"346","19.191753","192.168.2.22","57.144.115.32","TCP","54","2229  >  443 [ACK] Seq=9908 Ack=4519 Win=66816 Len=0"
"347","19.246864","104.18.32.47","192.168.2.22","TCP","60","443  >  2160 [ACK] Seq=10356 Ack=9265 Win=64 Len=0"
"348","19.248781","104.18.32.47","192.168.2.22","TCP","60","443  >  2160 [ACK] Seq=10356 Ack=10665 Win=64 Len=0"
"349","19.248781","104.18.32.47","192.168.2.22","TCP","60","443  >  2160 [ACK] Seq=10356 Ack=12065 Win=64 Len=0"
"350","19.248781","104.18.32.47","192.168.2.22","TCP","60","443  >  2160 [ACK] Seq=10356 Ack=13465 Win=65 Len=0"
"351","19.248781","104.18.32.47","192.168.2.22","TCP","60","443  >  2160 [ACK] Seq=10356 Ack=14865 Win=65 Len=0"
"352","19.248781","104.18.32.47","192.168.2.22","TCP","60","443  >  2160 [ACK] Seq=10356 Ack=16265 Win=65 Len=0"
"353","19.248781","104.18.32.47","192.168.2.22","TCP","60","443  >  2160 [ACK] Seq=10356 Ack=19033 Win=66 Len=0"
"354","19.248781","104.18.32.47","192.168.2.22","TCP","60","443  >  2160 [ACK] Seq=10356 Ack=19901 Win=66 Len=0"
"355","19.260929","192.168.2.22","35.190.80.1","TLSv1.2","227","Application Data"
"356","19.260993","192.168.2.22","35.190.80.1","TLSv1.2","93","Application Data"
